{"id":"22222222-2222-4222-8222-222222222222","text":"图片仍在上传。","recorded_at":"2026-10-22T10:30:00+08:00","raw_version":1,"attachments":[{"id":"33333333-3333-4333-8333-333333333333","order":0,"mime_type":"image/png","size_bytes":123,"sha256":"aaaaaaaaaaaaaaaaaaaaaaaaaaaaaaaaaaaaaaaaaaaaaaaaaaaaaaaaaaaaaaaa"}]}
